Data layer,Workflow role,LEMPA executed source/status,Minimum requirement for future studies,Common failure if weak or absent,LEMPA lesson
Organ-matched cell atlas,Defines biologically plausible cell states and pathway targets before any imaging linkage is attempted,"Human Cell Atlas lung atlas; 584944 cells across 50 annotated cell types; strong atlas layer retained","Organ-matched reference with stable cell annotation and clearly defined pathway programs","Targets may be biologically implausible or too noisy to justify downstream validation","A strong atlas can be publishable and reusable even when patient-level radiogenomic validation fails"
Paired bulk RNA-seq or transcriptomic target layer,Supplies patient-level molecular targets for deconvolution module construction and pathway scoring,"Paired NSCLC transcriptomic layer available for 130 linked patients after inner join","One-to-one patient-linked molecular matrix with QC and sample manifest","Imaging cannot be benchmarked against patient-level molecular truth","Public paired RNA is the core bridge layer; without it radiogenomics remains speculative"
Imaging feature layer,Provides the non-invasive predictor space to be tested against transcriptomic targets,"162 radiomics-processing patients; 130 retained in paired analysis; QC feature table exists","Harmonized feature extraction modality provenance and explicit QC thresholds","Feature instability or untracked preprocessing can overwhelm any biologic signal","Imaging availability alone did not guarantee recoverable atlas-derived targets"
ROI mask / segmentation layer,Defines what tissue is measured and whether radiomic predictors are reproducible,"Mask provenance available in frozen outputs; H4b audit showed SEG=117 and fallback_body_outline=12","Auditable mask source for each patient and clear fallback rules","Feature values may drift because the sampled region is inconsistent or weakly documented","Mask provenance should be surfaced explicitly because it affects trust in feature-based associations"
Technical and cohort metadata,Enables attrition accounting held-out robustness checks and descriptive confounding review,"Pairing attrition documented; site/vendor metadata available but too limited for robust V2 held-out splits","Site scanner batch histology and linkage metadata with enough spread to support robustness testing","Transportability cannot be assessed; apparent internal findings may be non-generalizable","V2-G5 could not be estimated because frozen local strata were not rich enough for held-out robustness"
Independent external paired cohort,Converts an internal stress test into a real replication surface,"Not available; Phase C remains dormant pending explicit trigger criteria","Independent paired imaging-plus-RNA cohort with N >= 100 one-to-one linkage and technical covariates","The study can report only an internal benchmark or negative stress test not external validation","No external paired cohort means archive the broad line rather than narrate a near-success"
